{
  "$schema": "http://json-schema.org/draft-07/schema#",
  "$id": "style-recipe.schema.json",
  "title": "Style Recipe (backing SSOT for genome_tags.primary_style_id)",
  "description": "Backing du tag style_id (1ere classe SANS backing avant ce schema, jumeau exact de la mecanique pre-registry). Une fiche par valeur de l'enum style_id (22, miroir A=B genome.schema <-> decomposition.schema). Vit a resources/registries/styles/{style_id}.json, indexe par resources/registries/style-registry.md (jumeau de creative-mechanics-registry.md). CONSOMME par compose/recompose/adapt (render_recipe -> prompt + model_params + anti_ai_guardrails) et par qc-creative Axe 4 (da_compat). UNIFIE visuel+video des le depart: bloc model_params.video_params pour les styles temporels. NE definit AUCUN nouveau style_id (l'enum reste SSOT cote genome/decomposition); ce schema lui ADOSSE une recette. v1.0 baseline.",
  "_schema_version": "style-recipe/1.0",
  "_changelog": {
    "1.0": "Baseline. Backing du tag primary_style_id. Aligne sur l'enum 22 de genome.schema/decomposition.schema. Champs: family, typology_st, render_recipe (prompt skeleton + slots), model_params (+ video_params), anti_ai_guardrails, da_compat, refs, related_mechanic_ids, promotion. Promotion via library-pattern pattern_type 'visual-style' (>=2 sources independantes)."
  },
  "type": "object",
  "required": [
    "style_id",
    "display_name",
    "typology_st",
    "description",
    "render_recipe",
    "anti_ai_guardrails",
    "da_compat"
  ],
  "additionalProperties": false,
  "properties": {
    "_schema": { "type": "string", "description": "OPTIONNEL additif. Si present vaut 'style-recipe'." },
    "_version": { "type": "string", "description": "OPTIONNEL additif. Alias lisible de _schema_version." },
    "style_id": {
      "type": "string",
      "description": "L'une des 22 valeurs de l'enum SSOT (genome.schema primary_style_id = decomposition.schema style_id). NE PAS en creer de nouvelle.",
      "enum": [
        "real-photo-lifestyle",
        "real-photo-testimonial-static",
        "real-photo-product-studio",
        "real-photo-macro-detail",
        "ugc-selfie-talking",
        "claymation-3d-ai",
        "illustrated-pov-cartoon",
        "3d-anatomy-realistic",
        "3d-anatomy-stylized",
        "3d-anatomy-xray",
        "stock-footage-broll",
        "pack-shot-brand-template",
        "brand-motion-graphic",
        "macro-photo-mouth-skin-etc",
        "graphic-icons-overlay",
        "split-screen-comparison",
        "screen-recording-mockup",
        "diagram-medical-2d",
        "stop-motion-physical",
        "ai-generated-realistic-photo",
        "ai-generated-stylized",
        "other"
      ]
    },
    "display_name": { "type": "string", "description": "Nom humain court (ex 'Photo lifestyle reelle')." },
    "family": {
      "type": "string",
      "description": "Famille de regroupement (pour l'index + da_compat).",
      "enum": ["real-photo", "ugc", "3d-anatomy", "ai-generated", "graphic-overlay", "motion-graphic", "comparison", "screen-mockup", "diagram", "stop-motion", "stock", "packshot", "other"]
    },
    "typology_st": {
      "type": "string",
      "description": "Spatial (image fixe), temporel (video/motion natif), variable (les deux selon support).",
      "enum": ["spatial", "temporel", "variable"]
    },
    "description": { "type": "string", "description": "Ce que le style EST + quand l'utiliser (1-3 phrases)." },
    "render_recipe": {
      "type": "object",
      "description": "La recette de rendu reutilisable: le squelette de prompt + ses slots + les parametres craft. C'est ce que compose lit pour piloter le prompt au lieu de l'improviser.",
      "required": ["prompt_skeleton"],
      "additionalProperties": false,
      "properties": {
        "prompt_skeleton": { "type": "string", "description": "Squelette de prompt avec slots {entre_accolades} a remplir au runtime (ex '{product} on {surface}, {lighting}, {camera}')." },
        "slots": {
          "type": "array",
          "description": "Les slots a remplir + ce qu'ils attendent.",
          "items": {
            "type": "object",
            "additionalProperties": false,
            "required": ["name", "description"],
            "properties": { "name": { "type": "string" }, "description": { "type": "string" } }
          }
        },
        "lighting": { "type": "string" },
        "camera_lens": { "type": "string" },
        "palette_mood": { "type": "string" },
        "texture_grain": { "type": "string" },
        "composition_notes": { "type": "string" }
      }
    },
    "model_params": {
      "type": "object",
      "description": "Reglages outil recommandes. video_params present seulement pour les styles temporels.",
      "additionalProperties": false,
      "properties": {
        "recommended_endpoint": { "type": "string", "description": "Ex 'fal-ai/nano-banana-pro' (image), endpoint video a definir cote bras video." },
        "settings": { "type": "object", "additionalProperties": true, "description": "Params libres (aspect_ratio, resolution, guidance...)." },
        "video_params": {
          "type": "object",
          "additionalProperties": true,
          "description": "UNIFIE visuel+video. Motion, duree, transitions pour les styles temporels (ugc-selfie-talking, stock-footage-broll, brand-motion-graphic, stop-motion-physical, screen-recording-mockup). Alimente le bras video quand il arrive.",
          "properties": {
            "motion": { "type": "string" },
            "duration_s_range": { "type": "array", "items": { "type": "number" }, "minItems": 2, "maxItems": 2 },
            "transitions": { "type": "string" }
          }
        }
      }
    },
    "anti_ai_guardrails": {
      "type": "array",
      "description": "Les defauts IA a BANNIR specifiquement pour CE style (lu par qc-creative Axe 5). Ex real-photo: 'peau plastique/cireuse', 'doigts surnumeraires', 'regard mort'. 3d-anatomy: 'anatomie fausse', 'organes mal places'.",
      "minItems": 1,
      "items": { "type": "string" }
    },
    "da_compat": {
      "type": "object",
      "description": "Compatibilite DA: ou ce style va (creative_zone de marque) et avec quoi il se marie.",
      "required": ["creative_zone_fit"],
      "additionalProperties": false,
      "properties": {
        "creative_zone_fit": {
          "type": "array",
          "description": "Fourchette de creative_zone marque (0-10) ou ce style est pertinent [min, max].",
          "items": { "type": "integer", "minimum": 0, "maximum": 10 },
          "minItems": 2,
          "maxItems": 2
        },
        "pairs_well_with": { "type": "array", "items": { "type": "string" }, "description": "Autres style_id qui se marient bien (ex en carrousel multi-frame)." },
        "avoid_when": { "type": "array", "items": { "type": "string" }, "description": "Conditions ou ce style est un mauvais choix." }
      }
    },
    "refs": { "type": "array", "items": { "type": "string" }, "description": "References visuelles / exemples (descriptions ou ad_ids du corpus)." },
    "related_mechanic_ids": { "type": "array", "items": { "type": "string" }, "description": "Pont optionnel vers les mecaniques du creative-mechanics-registry qui se composent bien avec ce style." },
    "promotion": {
      "type": "object",
      "description": "Statut de promotion (meme doctrine que les hooks: watch -> promote-ready sur >=2 sources independantes, via library-pattern pattern_type 'visual-style').",
      "additionalProperties": false,
      "properties": {
        "status": { "type": "string", "enum": ["watch", "promote-ready", "canon"] },
        "sources": { "type": "array", "items": { "type": "string" } }
      }
    }
  }
}
